{
  "schemaVersion": 2,
  "status": "BLOCKED",
  "productVersion": "0.1.2",
  "teamId": "K7LY92JY96",
  "osVersion": "26.6.1",
  "lowerOsRuntime": "NATIVE_AUTOFILL_LOWER_OS_RUNTIME_UNVERIFIED",
  "productionPromoted": false,
  "artifactHashes": {
    "appSha256": null,
    "dmgSha256": null
  },
  "codes": [
    "NATIVE_AUTOFILL_TOOLING_IMPLEMENTED",
    "NATIVE_AUTOFILL_TEMP_KEYCHAIN_IDENTITY_PASS",
    "NATIVE_AUTOFILL_PROVIDER_PROFILE_MISSING",
    "NATIVE_AUTOFILL_NOTARY_PROFILE_MISSING",
    "NATIVE_AUTOFILL_NOTARY_ISSUER_ID_MISSING",
    "NATIVE_AUTOFILL_SIGNED_ARTIFACT_MISSING",
    "NATIVE_AUTOFILL_CURRENT_GUI_SESSION_BLOCKED_LOGINWINDOW",
    "NATIVE_AUTOFILL_PRODUCTION_NOT_PROMOTED"
  ],
  "liveMatrix": {
    "freshInstallCurrent": "NATIVE_AUTOFILL_LIVE_BLOCKED_NO_RELEASE_ARTIFACT",
    "updateCurrent": "NATIVE_AUTOFILL_LIVE_BLOCKED_NO_RELEASE_ARTIFACT",
    "providerEnablement": "NATIVE_AUTOFILL_LIVE_BLOCKED_NO_RELEASE_ARTIFACT",
    "supportedField": "NATIVE_AUTOFILL_LIVE_BLOCKED_NO_RELEASE_ARTIFACT",
    "unsupportedField": "NATIVE_AUTOFILL_LIVE_BLOCKED_NO_RELEASE_ARTIFACT",
    "exactMatch": "NATIVE_AUTOFILL_LIVE_BLOCKED_NO_RELEASE_ARTIFACT",
    "fuzzyMatch": "NATIVE_AUTOFILL_LIVE_BLOCKED_NO_RELEASE_ARTIFACT",
    "fullSearch": "NATIVE_AUTOFILL_LIVE_BLOCKED_NO_RELEASE_ARTIFACT",
    "axDenied": "NATIVE_AUTOFILL_LIVE_BLOCKED_NO_RELEASE_ARTIFACT",
    "axGranted": "NATIVE_AUTOFILL_LIVE_BLOCKED_NO_RELEASE_ARTIFACT",
    "lock": "NATIVE_AUTOFILL_LIVE_BLOCKED_NO_RELEASE_ARTIFACT",
    "reprompt": "NATIVE_AUTOFILL_LIVE_BLOCKED_NO_RELEASE_ARTIFACT",
    "accountSwitch": "NATIVE_AUTOFILL_LIVE_BLOCKED_NO_RELEASE_ARTIFACT",
    "logout": "NATIVE_AUTOFILL_LIVE_BLOCKED_NO_RELEASE_ARTIFACT",
    "appRestart": "NATIVE_AUTOFILL_LIVE_BLOCKED_NO_RELEASE_ARTIFACT",
    "agentRestart": "NATIVE_AUTOFILL_LIVE_BLOCKED_NO_RELEASE_ARTIFACT",
    "offline": "NATIVE_AUTOFILL_LIVE_BLOCKED_NO_RELEASE_ARTIFACT",
    "staleGeneration": "NATIVE_AUTOFILL_LIVE_BLOCKED_NO_RELEASE_ARTIFACT"
  }
}
